{
  "schema_version": 1,
  "verdict": "changes_requested",
  "action_items": [
    {
      "id": "R5",
      "severity": "critical",
      "category": "patch",
      "target_role": "maker",
      "location": "scripts/tl_story_authority.py:887; scripts/tl_story_authority.py:845; scripts/tl_story_authority.py:1485; scripts/tl_runtime.py:1318",
      "problem": "A derivação persistida não é validada contra o envelope antes de autorizar o batch. record_child_derived() aceita e journaliza qualquer proposal/proof sob lease; load_child_derivation() só valida os digests internos; e o runtime compara o batch apenas contra a proposal carregada. Assim, uma proposal/proof autoconsistente, mas com allowed_effects, escopo ou predecessora fora do envelope, pode ser registrada e executada.",
      "evidence": "verify_derivation() contém as verificações de subconjunto de escopo, efeitos, orçamento e linhagem em scripts/tl_story_authority.py:1278-1368, mas não é chamado por record_child_derived() (linhas 887-909), load_child_derivation() (845-885) nem _bind_and_verify_auto_story_child() (1318-1351). assert_batch_matches_child_proposal() usa required/conditional e allowed_effects da própria proposal (1496-1528), sem revalidá-los contra payload. Os testes cobrem digest adulterado e expansão do batch contra uma proposal válida, mas não uma proposal persistida maliciosa porém autodigerida.",
      "required_action": "Tornar a derivação uma transição validada sob o lease: antes de persistir child_derived, recomputar e exigir uma prova válida para a proposal contra o envelope e o estado atual; ao bind no runtime, revalidar independentemente contenção, efeitos, orçamento, predecessor/closure e checkpoint contra o envelope, sem confiar apenas no digest ou em proof.checks. Adicionar contraprovas de uma proposal/proof autodigerida registrada diretamente com efeito expandido e com escopo expandido, exigindo HARD STOP antes de child_open/worker."
    }
  ],
  "deferred": [],
  "rejected": [
    {
      "summary": "R1 da rodada anterior foi sanado: literal de autorização não aceita whitespace periférico nem newline.",
      "evidence": "scripts/tl_story_authority.py:237 valida isinstance(str) e AUTHORIZATION_LITERAL_RE termina em \\Z; testes em tests/test_story_authority_digest.py exercitam espaço, tab e newline."
    },
    {
      "summary": "R3 da rodada anterior foi sanado: retry com zero reworks é recusado.",
      "evidence": "scripts/validate_execution_plan.py:559-575 rejeita nomes duplicados, exige straight_line == 0 e retry >= 1; tests/test_execution_plan_validator.py cobre retry=0."
    },
    {
      "summary": "R4 possui evidência declarada para o SHA examinado.",
      "evidence": "O briefing vincula canonical_full_gate verde ao commit 84b45c1893875b27b3b5122d876dcf994f324b70, GitHub Actions Run 35277289909; o alvo local resolve exatamente para esse SHA e git diff --check contra origin/main não reportou erros."
    },
    {
      "summary": "Não foi identificado novo defeito material nas lentes de corrida ou esgotamento.",
      "evidence": "A autoridade usa lease exclusivo antes de reserva/derivação, e o diff não introduz timers, threads ou I/O de rede assíncrono. audit_diff.py foi executado contra origin/main; não reportou blocker de código, apenas avisos lexicais em documentação e evidência não rastreada."
    }
  ]
}