{
  "schema_version": 1,
  "verdict": "changes_requested",
  "action_items": [
    {
      "id": "R5",
      "severity": "medium",
      "category": "patch",
      "target_role": "maker",
      "location": "src/connector.py:118",
      "problem": "The final attempt still sleeps for the full backoff interval before returning the failure.",
      "evidence": "test_connector.py::test_ceiling observed a 3.2s wall clock for a call that had no attempt left.",
      "required_action": "Skip the backoff sleep when the attempt just made was the last one permitted."
    },
    {
      "id": "R6",
      "severity": "low",
      "category": "patch",
      "target_role": "maker",
      "location": "tests/test_connector.py:64",
      "problem": "The retry test asserts the call count but never asserts the backoff ceiling is respected.",
      "evidence": "Removing the ceiling clamp in src/connector.py leaves the suite green.",
      "required_action": "Assert the observed sleep sequence is bounded by the configured ceiling."
    }
  ],
  "deferred": [],
  "rejected": []
}
